iteration	timestamp	framework_version	change_description	avg_std	max_std	high_confidence_pct	composite_score	decision	notes
0	2026-04-25 00:14:55	2.19.0	baseline	8.0	17.3	16.7	-6.33	baseline	现状洞察度 std=17.3（Kimi-K2.6 评分偏低），结论可接受性 std=11.5
1	2026-04-25 09:18:39	2.21.0	优化现状洞察度到达点评分指引	7.9	16.2	16.7	-6.23	keep	现状洞察度 std 从 17.3 降至 16.2，复合评分 +0.10
2	2026-04-25 09:28:07	2.22.0	优化结论可接受性中国法学语境标准	7.6	11.0	16.7	-5.93	keep	最大 std 从 16.2 降至 11.0（-5.2），复合评分 +0.30
3	2026-04-25 09:42:05	2.23.0	优化现状洞察度未竟点和本文切入点标准	7.9	11.0	16.7	-6.23	discard	退化 -0.30，现状洞察度 std 未改善，其他维度反而上升
4	2026-04-25 09:58:25	2.24.0	优化分析框架建构力后文调用和法学转化标准	7.3	10.6	16.7	-5.63	keep	分析框架建构力 std 从 9.1 降至 5.0（-4.1），复合评分 +0.30
5	2026-04-25 10:09:31	2.25.0	优化结论可接受性制度可接受度标准	8.2	11.0	16.7	-6.53	discard	严重退化 -0.90，分析框架建构力 std 从 5.0 回升到 9.1，失去迭代 4 成果
